{
  "schema_version": "1.0.0",
  "document_id": "doc_uuid_a1b2c3d4",
  "ticket_id": "PAY-451",
  "created_at_utc": "2025-10-29T10:00:00Z",
  "source_commit_hash": "a1b2c3d4e5f6a7b8c9d0e1f2a3b4c5d6e7f8a9b0",
  "author": "developer@yourcompany.com",

  "problem_details": {
    "problem_summary": "TypeError when accessing 'id' property of undefined 'req.user' object.",
    "detail_problem": "The 'handlePayment' function at line 182 directly accessed `req.user.id` assuming the 'user' object would always be present. This assumption fails for unauthenticated, session-expired, or malformed requests where `req.user` is 'undefined'. This leads to a critical TypeError that crashes the entire payment processing flow.",
    "error_message": "TypeError: Cannot read property 'id' of undefined",
    "source_file": "src/payments/handler.js",
    "function_name": "handlePayment",
    "line_range": "180-230",
    "full_stack_trace": "TypeError: Cannot read property 'id' of undefined\n    at handlePayment (src/payments/handler.js:182:25)\n    at Layer.handle [as handle_request] (/app/node_modules/express/lib/router/layer.js:95:5)\n    at next (/app/node_modules/express/lib/router/route.js:144:13)\n    at authenticated (/app/middleware/auth.js:45:3)\n    at Layer.handle [as handle_request] (/app/node_modules/express/lib/router/layer.js:95:5)"
  },

  "analysis_and_solution": {
    "summary": "A TypeError occurred in the payment handler because the 'req.user' object was accessed before it was verified to exist, likely in an unauthenticated request.",
    "root_cause_pattern": "Missing Guard Clause / Null Check",
    
    "detailed_solution_narrative": "The code at line 182 attempted to access 'req.user.id' directly. However, in scenarios like an expired session or an unauthenticated API call, the 'req.user' object is 'undefined'. This caused the 'TypeError'. The fix introduces a guard clause to check for the existence of 'req.user' before any properties are accessed, returning a 401 'Unauthorized' status if it is missing.",
    
    "code_diff": "--- a/src/payments/handler.js\n+++ b/src/payments/handler.js\n@@ -181,1 +181,4 @@\n function handlePayment(req, res) {\n+  if (!req.user) {\n+    return res.status(401).send('Unauthorized');\n+  }\n   const userId = req.user.id;"
  },

  "metadata_for_retrieval": {
    "repo": "payments-service",
    "branch": "main",
    "language": "javascript",
    "tags": ["TypeError", "auth", "guard-clause", "payments-service", "req.user", "File"],
    "state": "accepted",
    "severity": "critical",
    "impact_scope": "api-gateway",
    "related_tickets": ["PAY-301", "AUTH-112"],
    "embedding_type": "cosmos_v1_bugdoc"
  },

  "text_for_embedding": "TypeError when accessing 'id' property of undefined 'req.user' object.\nThe 'handlePayment' function at line 182 directly accessed `req.user.id` assuming the 'user' object would always be present. This assumption fails for unauthenticated, session-expired, or malformed requests where `req.user` is 'undefined'. This leads to a critical TypeError that crashes the entire payment processing flow.\nTypeError: Cannot read property 'id' of undefined\nhandlePayment\nMissing Guard Clause / Null Check\nA TypeError occurred in the payment handler because the 'req.user' object was accessed before it was verified to exist, likely in an unauthenticated request.\nThe code at line 182 attempted to access 'req.user.id' directly. However, in scenarios like an expired session or an unauthenticated API call, the 'req.user' object is 'undefined'. This caused the 'TypeError'. The fix introduces a guard clause to check for the existence of 'req.user' before any properties are accessed, returning a 401 'Unauthorized' status if it is missing.\nTypeError auth guard-clause payments-service req.user File"
}

